{
  "manifest_version": "1.0",
  "manifest_id": "manifest-imported-m15-example",
  "task": {
    "project_id": "project-ownhands",
    "worktree_id": "worktree-imported",
    "task_id": "task-imported-context",
    "mode": "imported",
    "target_commit": "93ffcbef6c0b76ba8a7d4c12f70cfc11a9528f0c",
    "cwd": "/fixture/own-hands",
    "environment_ref": "imported-codex-session"
  },
  "context_sources": [
    {
      "source_id": "context-imported-agents",
      "source_type": "agents_instruction",
      "locator": {"kind": "repository_path", "value": "AGENTS.md"},
      "content_hash": "sha256:cccccccccccccccccccccccccccccccccccccccccccccccccccccccccccccccc",
      "version": "git:93ffcbef",
      "scope": {"kind": "project", "value": "repository root"},
      "freshness": {"status": "current", "basis": "observed", "checked_at": "2026-09-05T00:00:00+00:00", "evidence_refs": ["evidence-imported-file-hash"]},
      "applicability": {"decision": "unobserved", "basis": "unobserved", "reason": "the session began before ownhands management", "evidence_refs": []},
      "realization": {
        "configured": {"result": "pass", "basis": "observed", "evidence_refs": ["evidence-imported-file-hash"], "inference_from": [], "checked_at": "2026-09-05T00:00:00+00:00", "exact_scope": "AGENTS.md at import time", "residual_risks": ["the earlier file version is unobserved"]},
        "loaded": {"result": "not_run", "basis": "unobserved", "evidence_refs": [], "inference_from": [], "checked_at": null, "exact_scope": "", "residual_risks": ["the imported runtime did not expose a load receipt"]},
        "enforced": {"result": "not_run", "basis": "unobserved", "evidence_refs": [], "inference_from": [], "checked_at": null, "exact_scope": "", "residual_risks": ["instructions are not deterministic controls"]}
      }
    }
  ],
  "control_sources": [],
  "instruction_overlay": {"source_refs": [], "skill_invocations": [], "excluded_source_refs": ["context-imported-agents"]},
  "control_overlay": {"source_refs": [], "immutable_source_refs": []},
  "event_refs": ["event-task-imported"],
  "evidence_refs": ["evidence-imported-file-hash"],
  "generated_at": "2026-09-05T00:03:00+00:00"
}
